{
  "x402": {
    "verb": "describe",
    "version": "1.0.0",
    "request_id": "req-describe-2025-11-19-0001"
  },
  "actor": "did:example:caller-001",
  "limits": {
    "max_output_tokens": 512,
    "timeout_ms": 4000
  },
  "channel": {
    "protocol": "https",
    "input_modalities": ["text"],
    "output_modalities": ["text"]
  },
  "input": {
    "subject": "CommandLayer protocol-commons repository",
    "context": "Public GitHub repo containing canonical verb schemas for agents.",
    "detail_level": "medium",
    "audience": "protocol-engineer"
  }
}
